{"imports":["fastapi","httpx","mavsdk","pydantic","serial","uvicorn","websockets","yaml","zeroconf"],"platform":"manylinux_2_39_aarch64","python_abi":"cp312","requirements_sha256":"eef0609054277c36ef3a9b74f4e73fd58da3606c5cfff503e05f6440e863904a","resolver":{"index_digest":"sha256:afc139a0a640942491ec481ad8dda10f2c5b753f5c969393b12480155fe15a63","pip_version":"24.0","platform":"linux/amd64","platform_digest":"sha256:fd3817f3a855f6c2ada16ac9468e5ee93e361005bd226fd5a5ee1a504e038c84","reference":"docker.io/library/python:3.12.3-slim-bookworm"},"schema":"iii.python-wheel-lock/v1","wheels":[{"filename":"annotated_types-0.8.0-py3-none-any.whl","name":"annotated-types","requires":[],"sha256":"f072f4d804ea359e4eaf198b1af7a8b0943881a87f31bb764f8bf219bb9419e0","tags":["py3-none-any"],"version":"0.8.0"},{"filename":"anyio-4.15.0-py3-none-any.whl","name":"anyio","requires":["exceptiongroup>=1.0.2; python_version < \"3.11\"","idna>=2.8","trio>=0.32.0; extra == \"trio\"","typing_extensions>=4.16.0; python_version < \"3.15\""],"sha256":"7ecd9937369ffce8bba0b5ccb9b3a9507b101b0ed50256aecfbab27e6c2acb99","tags":["py3-none-any"],"version":"4.15.0"},{"filename":"certifi-2026.7.22-py3-none-any.whl","name":"certifi","requires":[],"sha256":"62f22742b58a1a33014a2b6b706588a8d7e2a88ae7bd1a6ebe8c992928483775","tags":["py3-none-any"],"version":"2026.7.22"},{"filename":"click-8.5.0-py3-none-any.whl","name":"click","requires":[],"sha256":"255bc9599cf7748b4b1a446ccc735421bd08a2ae529a8b88597d3de5664ee360","tags":["py3-none-any"],"version":"8.5.0"},{"filename":"fastapi-0.116.1-py3-none-any.whl","name":"fastapi","requires":["email-validator>=2.0.0; extra == \"all\"","email-validator>=2.0.0; extra == \"standard\"","email-validator>=2.0.0; extra == \"standard-no-fastapi-cloud-cli\"","fastapi-cli[standard-no-fastapi-cloud-cli]>=0.0.8; extra == \"standard-no-fastapi-cloud-cli\"","fastapi-cli[standard]>=0.0.8; extra == \"all\"","fastapi-cli[standard]>=0.0.8; extra == \"standard\"","httpx>=0.23.0; extra == \"all\"","httpx>=0.23.0; extra == \"standard\"","httpx>=0.23.0; extra == \"standard-no-fastapi-cloud-cli\"","itsdangerous>=1.1.0; extra == \"all\"","jinja2>=3.1.5; extra == \"all\"","jinja2>=3.1.5; extra == \"standard\"","jinja2>=3.1.5; extra == \"standard-no-fastapi-cloud-cli\"","orjson>=3.2.1; extra == \"all\"","pydantic!=1.8,!=1.8.1,!=2.0.0,!=2.0.1,!=2.1.0,<3.0.0,>=1.7.4","pydantic-extra-types>=2.0.0; extra == \"all\"","pydantic-settings>=2.0.0; extra == \"all\"","python-multipart>=0.0.18; extra == \"all\"","python-multipart>=0.0.18; extra == \"standard\"","python-multipart>=0.0.18; extra == \"standard-no-fastapi-cloud-cli\"","pyyaml>=5.3.1; extra == \"all\"","starlette<0.48.0,>=0.40.0","typing-extensions>=4.8.0","ujson!=4.0.2,!=4.1.0,!=4.2.0,!=4.3.0,!=5.0.0,!=5.1.0,>=4.0.1; extra == \"all\"","uvicorn[standard]>=0.12.0; extra == \"all\"","uvicorn[standard]>=0.12.0; extra == \"standard\"","uvicorn[standard]>=0.12.0; extra == \"standard-no-fastapi-cloud-cli\""],"sha256":"c46ac7c312df840f0c9e220f7964bada936781bc4e2e6eb71f1c4d7553786565","tags":["py3-none-any"],"version":"0.116.1"},{"filename":"grpcio-1.83.1-cp312-cp312-manylinux2014_aarch64.manylinux_2_17_aarch64.whl","name":"grpcio","requires":["grpcio-tools>=1.83.1; extra == \"protobuf\"","typing-extensions~=4.12"],"sha256":"5ccc26715fd4defca5e129e280dd883b1737b65045ec50ffe22ce42104089519","tags":["cp312-cp312-manylinux2014_aarch64","cp312-cp312-manylinux_2_17_aarch64"],"version":"1.83.1"},{"filename":"h11-0.16.0-py3-none-any.whl","name":"h11","requires":[],"sha256":"63cf8bbe7522de3bf65932fda1d9c2772064ffb3dae62d55932da54b31cb6c86","tags":["py3-none-any"],"version":"0.16.0"},{"filename":"httpcore-1.0.9-py3-none-any.whl","name":"httpcore","requires":["anyio<5.0,>=4.0; extra == 'asyncio'","certifi","h11>=0.16","h2<5,>=3; extra == 'http2'","socksio==1.*; extra == 'socks'","trio<1.0,>=0.22.0; extra == 'trio'"],"sha256":"2d400746a40668fc9dec9810239072b40b4484b640a8c38fd654a024c7a1bf55","tags":["py3-none-any"],"version":"1.0.9"},{"filename":"httpx-0.28.1-py3-none-any.whl","name":"httpx","requires":["anyio","brotli; (platform_python_implementation == 'CPython') and extra == 'brotli'","brotlicffi; (platform_python_implementation != 'CPython') and extra == 'brotli'","certifi","click==8.*; extra == 'cli'","h2<5,>=3; extra == 'http2'","httpcore==1.*","idna","pygments==2.*; extra == 'cli'","rich<14,>=10; extra == 'cli'","socksio==1.*; extra == 'socks'","zstandard>=0.18.0; extra == 'zstd'"],"sha256":"d909fcccc110f8c7faf814ca82a9a4d816bc5a6dbfea25d6591d6985b8ba59ad","tags":["py3-none-any"],"version":"0.28.1"},{"filename":"idna-3.19-py3-none-any.whl","name":"idna","requires":["coverage >= 7.10.0 ; extra == \"all\"","hypothesis >= 6.141.1 ; extra == \"all\"","mypy >= 1.11.2 ; extra == \"all\"","pytest >= 8.3.2 ; extra == \"all\"","ruff >= 0.16.0 ; extra == \"all\"","ty >= 0.0.37 ; extra == \"all\""],"sha256":"815e7be7a7806d54abb586dc943addc79e8b2ee16915059658cbeff4b1b43bf4","tags":["py3-none-any"],"version":"3.19"},{"filename":"ifaddr-0.2.0-py3-none-any.whl","name":"ifaddr","requires":[],"sha256":"085e0305cfe6f16ab12d72e2024030f5d52674afad6911bb1eee207177b8a748","tags":["py3-none-any"],"version":"0.2.0"},{"filename":"mavsdk-3.17.2-py3-none-manylinux2014_aarch64.whl","name":"mavsdk","requires":["grpcio>=1.64.1","protobuf>=6.32.1"],"sha256":"99e58f26705127986fa5e1358e3688aa4e4f8d006e719d2d39179d03368039f8","tags":["py3-none-any"],"version":"3.17.2"},{"filename":"protobuf-7.36.1-cp310-abi3-manylinux2014_aarch64.whl","name":"protobuf","requires":[],"sha256":"43d3d37b1eb24c113b9b7d02008cac44e423f00b611b7781ae998d7623972969","tags":["cp310-abi3-manylinux2014_aarch64"],"version":"7.36.1"},{"filename":"pydantic-2.11.7-py3-none-any.whl","name":"pydantic","requires":["annotated-types>=0.6.0","email-validator>=2.0.0; extra == 'email'","pydantic-core==2.33.2","typing-extensions>=4.12.2","typing-inspection>=0.4.0","tzdata; (python_version >= '3.9' and platform_system == 'Windows') and extra == 'timezone'"],"sha256":"dde5df002701f6de26248661f6835bbe296a47bf73990135c7d07ce741b9623b","tags":["py3-none-any"],"version":"2.11.7"},{"filename":"pydantic_core-2.33.2-cp312-cp312-manylinux_2_17_aarch64.manylinux2014_aarch64.whl","name":"pydantic-core","requires":["typing-extensions>=4.6.0,!=4.7.0"],"sha256":"4e61206137cbc65e6d5256e1166f88331d3b6238e082d9f74613b9b765fb9025","tags":["cp312-cp312-manylinux_2_17_aarch64.manylinux2014_aarch64"],"version":"2.33.2"},{"filename":"pyserial-3.5-py2.py3-none-any.whl","name":"pyserial","requires":["hidapi; extra == 'cp2110'"],"sha256":"c4451db6ba391ca6ca299fb3ec7bae67a5c55dde170964c7a14ceefec02f2cf0","tags":["py2-none-any","py3-none-any"],"version":"3.5"},{"filename":"PyYAML-6.0.2-cp312-cp312-manylinux_2_17_aarch64.manylinux2014_aarch64.whl","name":"pyyaml","requires":[],"sha256":"1f71ea527786de97d1a0cc0eacd1defc0985dcf6b3f17bb77dcfc8c34bec4dc5","tags":["cp312-cp312-manylinux2014_aarch64","cp312-cp312-manylinux_2_17_aarch64"],"version":"6.0.2"},{"filename":"starlette-0.47.3-py3-none-any.whl","name":"starlette","requires":["anyio<5,>=3.6.2","httpx<0.29.0,>=0.27.0; extra == 'full'","itsdangerous; extra == 'full'","jinja2; extra == 'full'","python-multipart>=0.0.18; extra == 'full'","pyyaml; extra == 'full'","typing-extensions>=4.10.0; python_version < '3.13'"],"sha256":"89c0778ca62a76b826101e7c709e70680a1699ca7da6b44d38eb0a7e61fe4b51","tags":["py3-none-any"],"version":"0.47.3"},{"filename":"typing_extensions-4.16.0-py3-none-any.whl","name":"typing-extensions","requires":[],"sha256":"481caa481374e813c1b176ada14e97f1f67a4539ce9cfeb3f350d78d6370c2e8","tags":["py3-none-any"],"version":"4.16.0"},{"filename":"typing_inspection-0.4.4-py3-none-any.whl","name":"typing-inspection","requires":["typing-extensions>=4.15.0"],"sha256":"65b8397ba37ccbce054456aaccddfc91e6e3083c92824df348d96ca832f3f147","tags":["py3-none-any"],"version":"0.4.4"},{"filename":"uvicorn-0.35.0-py3-none-any.whl","name":"uvicorn","requires":["click>=7.0","colorama>=0.4; (sys_platform == 'win32') and extra == 'standard'","h11>=0.8","httptools>=0.6.3; extra == 'standard'","python-dotenv>=0.13; extra == 'standard'","pyyaml>=5.1; extra == 'standard'","typing-extensions>=4.0; python_version < '3.11'","uvloop>=0.15.1; (sys_platform != 'win32' and (sys_platform != 'cygwin' and platform_python_implementation != 'PyPy')) and extra == 'standard'","watchfiles>=0.13; extra == 'standard'","websockets>=10.4; extra == 'standard'"],"sha256":"197535216b25ff9b785e29a0b79199f55222193d47f820816e7da751e9bc8d4a","tags":["py3-none-any"],"version":"0.35.0"},{"filename":"websockets-15.0.1-cp312-cp312-manylinux_2_17_aarch64.manylinux2014_aarch64.whl","name":"websockets","requires":[],"sha256":"e8b56bdcdb4505c8078cb6c7157d9811a85790f2f2b3632c7d1462ab5783d215","tags":["cp312-cp312-manylinux2014_aarch64","cp312-cp312-manylinux_2_17_aarch64"],"version":"15.0.1"},{"filename":"zeroconf-0.147.0-cp312-cp312-manylinux_2_17_aarch64.manylinux2014_aarch64.whl","name":"zeroconf","requires":["ifaddr (>=0.1.7)"],"sha256":"04018f48c38fa174af8e2c6cd00e6fb8a9a7269a187ba1f52cf32c14f2ddd941","tags":["cp312-cp312-manylinux2014_aarch64","cp312-cp312-manylinux_2_17_aarch64"],"version":"0.147.0"}]}
